{"schema_version":"1.4","rfam_acc":"RF00005","seq_name":"8cbm_4_T_G","observation":"[category, fr3d_class, label_seq_id_1, label_seq_id_2, rfam_1, rfam_2, unit_id_1, unit_id_2, mapping_check, altlocs]; base pairs and stacking 5'->3' by label_seq_id (class flipped when needed); base-ribose and base-phosphate in BGSU row order: endpoint 1 = base, endpoint 2 = nucleotide whose ribose / phosphate is contacted (never re-ordered); rfam_k = consensus position (match), 'anchor^offset' (insertion) or null (outside the aligned region); last observation field: bgsu (BGSU RNA 3D Hub file) or fr3d_local (near base pair, local fr3d-python)","observations":[["basepair","cWW",2,67,2,69,"8CBM|1|T|G|2","8CBM|1|T|C|67","verified","","bgsu"],["basepair","cWW",3,66,3,68,"8CBM|1|T|A|3","8CBM|1|T|U|66","verified","","bgsu"],["basepair","cWW",4,65,4,67,"8CBM|1|T|A|4","8CBM|1|T|U|65","verified","","bgsu"],["basepair","cWW",5,64,5,66,"8CBM|1|T|A|5","8CBM|1|T|U|64","verified","","bgsu"],["basepair","cWW",6,63,6,65,"8CBM|1|T|U|6","8CBM|1|T|A|63","verified","","bgsu"],["basepair","cWW",7,62,7,64,"8CBM|1|T|A|7","8CBM|1|T|U|62","verified","","bgsu"],["basepair","ntWH",8,13,8,13,"8CBM|1|T|U|8","8CBM|1|T|G|13","verified","","fr3d_local"],["basepair","cWW",10,21,10,24,"8CBM|1|T|U|10","8CBM|1|T|A|21","verified","","bgsu"],["basepair","cWW",11,20,11,23,"8CBM|1|T|C|11","8CBM|1|T|G|20","verified","","bgsu"],["basepair","cWW",12,19,12,22,"8CBM|1|T|U|12","8CBM|1|T|A|19","verified","","bgsu"],["basepair","tSH",13,18,13,21,"8CBM|1|T|G|13","8CBM|1|T|A|18","verified","","bgsu"],["basepair","ncWW",23,39,26,42,"8CBM|1|T|U|23","8CBM|1|T|A|39","verified","","fr3d_local"],["basepair","cWW",24,38,27,41,"8CBM|1|T|U|24","8CBM|1|T|A|38","verified","","bgsu"],["basepair","cWW",25,37,28,40,"8CBM|1|T|A|25","8CBM|1|T|U|37","verified","","bgsu"],["basepair","cWW",26,36,29,39,"8CBM|1|T|C|26","8CBM|1|T|G|36","verified","","bgsu"],["basepair","cWW",27,35,30,38,"8CBM|1|T|U|27","8CBM|1|T|A|35","verified","","bgsu"],["basepair","ncWW",43,52,"45^1",54,"8CBM|1|T|A|43","8CBM|1|T|U|52","verified","","fr3d_local"],["basepair","cWW",45,61,47,63,"8CBM|1|T|A|45","8CBM|1|T|U|61","verified","","bgsu"],["basepair","cWW",46,60,48,62,"8CBM|1|T|G|46","8CBM|1|T|C|60","verified","","bgsu"],["basepair","cWW",47,59,49,61,"8CBM|1|T|G|47","8CBM|1|T|C|59","verified","","bgsu"],["basepair","cWW",48,58,50,60,"8CBM|1|T|A|48","8CBM|1|T|C|58","verified","","bgsu"],["basepair","cWW",49,57,51,59,"8CBM|1|T|G|49","8CBM|1|T|C|57","verified","","bgsu"],["basepair","ncWW",50,56,52,58,"8CBM|1|T|C|50","8CBM|1|T|C|56","verified","","fr3d_local"],["basepair","ntSH",51,55,53,57,"8CBM|1|T|U|51","8CBM|1|T|A|55","verified","","fr3d_local"],["basephosphate","n0BPh",30,29,33,32,"8CBM|1|T|G|30","8CBM|1|T|U|29","verified","","bgsu"],["basephosphate","n7BPh",42,41,45,44,"8CBM|1|T|A|42","8CBM|1|T|U|41","verified","","bgsu"],["basephosphate","n2BPh",43,54,"45^1",56,"8CBM|1|T|A|43","8CBM|1|T|A|54","verified","","bgsu"],["basephosphate","n7BPh",50,49,52,51,"8CBM|1|T|C|50","8CBM|1|T|G|49","verified","","bgsu"],["baseribose","n0BR",11,10,11,10,"8CBM|1|T|C|11","8CBM|1|T|U|10","verified","","bgsu"],["baseribose","n1BR",13,14,13,14,"8CBM|1|T|G|13","8CBM|1|T|A|14","verified","","bgsu"],["baseribose","n6BR",18,13,21,13,"8CBM|1|T|A|18","8CBM|1|T|G|13","verified","","bgsu"],["baseribose","0BR",45,7,47,7,"8CBM|1|T|A|45","8CBM|1|T|A|7","verified","","bgsu"],["baseribose","n9BR",50,49,52,51,"8CBM|1|T|C|50","8CBM|1|T|G|49","verified","","bgsu"],["baseribose","n0BR",59,58,61,60,"8CBM|1|T|C|59","8CBM|1|T|C|58","verified","","bgsu"],["baseribose","n0BR",63,62,65,64,"8CBM|1|T|A|63","8CBM|1|T|U|62","verified","","bgsu"],["baseribose","n0BR",64,63,66,65,"8CBM|1|T|U|64","8CBM|1|T|A|63","verified","","bgsu"],["baseribose","n0BR",67,66,69,68,"8CBM|1|T|C|67","8CBM|1|T|U|66","verified","","bgsu"],["stacking","s35",1,2,1,2,"8CBM|1|T|G|1","8CBM|1|T|G|2","verified","","bgsu"],["stacking","ns33",1,67,1,69,"8CBM|1|T|G|1","8CBM|1|T|C|67","verified","","bgsu"],["stacking","s55",1,68,1,70,"8CBM|1|T|G|1","8CBM|1|T|C|68","verified","","bgsu"],["stacking","s35",2,3,2,3,"8CBM|1|T|G|2","8CBM|1|T|A|3","verified","","bgsu"],["stacking","s35",3,4,3,4,"8CBM|1|T|A|3","8CBM|1|T|A|4","verified","","bgsu"],["stacking","ns55",3,67,3,69,"8CBM|1|T|A|3","8CBM|1|T|C|67","verified","","bgsu"],["stacking","s35",4,5,4,5,"8CBM|1|T|A|4","8CBM|1|T|A|5","verified","","bgsu"],["stacking","s55",4,66,4,68,"8CBM|1|T|A|4","8CBM|1|T|U|66","verified","","bgsu"],["stacking","s35",5,6,5,6,"8CBM|1|T|A|5","8CBM|1|T|U|6","verified","","bgsu"],["stacking","s55",5,65,5,67,"8CBM|1|T|A|5","8CBM|1|T|U|65","verified","","bgsu"],["stacking","s35",6,7,6,7,"8CBM|1|T|U|6","8CBM|1|T|A|7","verified","","bgsu"],["stacking","s35",7,45,7,47,"8CBM|1|T|A|7","8CBM|1|T|A|45","verified","","bgsu"],["stacking","s55",7,63,7,65,"8CBM|1|T|A|7","8CBM|1|T|A|63","verified","","bgsu"],["stacking","s55",8,44,8,46,"8CBM|1|T|U|8","8CBM|1|T|U|44","verified","","bgsu"],["stacking","s35",10,11,10,11,"8CBM|1|T|U|10","8CBM|1|T|C|11","verified","","bgsu"],["stacking","s55",10,22,10,25,"8CBM|1|T|U|10","8CBM|1|T|G|22","verified","","bgsu"],["stacking","s35",11,12,11,12,"8CBM|1|T|C|11","8CBM|1|T|U|12","verified","","bgsu"],["stacking","ns55",11,21,11,24,"8CBM|1|T|C|11","8CBM|1|T|A|21","verified","","bgsu"],["stacking","s35",12,13,12,13,"8CBM|1|T|U|12","8CBM|1|T|G|13","verified","","bgsu"],["stacking","s55",12,20,12,23,"8CBM|1|T|U|12","8CBM|1|T|G|20","verified","","bgsu"],["stacking","ns33",13,14,13,14,"8CBM|1|T|G|13","8CBM|1|T|A|14","verified","","bgsu"],["stacking","s55",13,19,13,22,"8CBM|1|T|G|13","8CBM|1|T|A|19","verified","","bgsu"],["stacking","ns35",13,44,13,46,"8CBM|1|T|G|13","8CBM|1|T|U|44","verified","","bgsu"],["stacking","s33",14,44,14,46,"8CBM|1|T|A|14","8CBM|1|T|U|44","verified","","bgsu"],["stacking","s35",18,19,21,22,"8CBM|1|T|A|18","8CBM|1|T|A|19","verified","","bgsu"],["stacking","s35",19,20,22,23,"8CBM|1|T|A|19","8CBM|1|T|G|20","verified","","bgsu"],["stacking","s35",20,21,23,24,"8CBM|1|T|G|20","8CBM|1|T|A|21","verified","","bgsu"],["stacking","s35",21,22,24,25,"8CBM|1|T|A|21","8CBM|1|T|G|22","verified","","bgsu"],["stacking","s35",22,23,25,26,"8CBM|1|T|G|22","8CBM|1|T|U|23","verified","","bgsu"],["stacking","s35",23,24,26,27,"8CBM|1|T|U|23","8CBM|1|T|U|24","verified","","bgsu"],["stacking","ns55",24,39,27,42,"8CBM|1|T|U|24","8CBM|1|T|A|39","verified","","bgsu"],["stacking","s35",25,26,28,29,"8CBM|1|T|A|25","8CBM|1|T|C|26","verified","","bgsu"],["stacking","s55",25,38,28,41,"8CBM|1|T|A|25","8CBM|1|T|A|38","verified","","bgsu"],["stacking","s35",26,27,29,30,"8CBM|1|T|C|26","8CBM|1|T|U|27","verified","","bgsu"],["stacking","s35",27,33,30,36,"8CBM|1|T|U|27","8CBM|1|T|A|33","verified","","bgsu"],["stacking","s55",27,36,30,39,"8CBM|1|T|U|27","8CBM|1|T|G|36","verified","","bgsu"],["stacking","s53",29,33,32,36,"8CBM|1|T|U|29","8CBM|1|T|A|33","verified","","bgsu"],["stacking","s53",32,34,35,37,"8CBM|1|T|U|32","8CBM|1|T|G|34","verified","","bgsu"],["stacking","s55",33,35,36,38,"8CBM|1|T|A|33","8CBM|1|T|A|35","verified","","bgsu"],["stacking","s35",35,36,38,39,"8CBM|1|T|A|35","8CBM|1|T|G|36","verified","","bgsu"],["stacking","s35",36,37,39,40,"8CBM|1|T|G|36","8CBM|1|T|U|37","verified","","bgsu"],["stacking","s35",37,38,40,41,"8CBM|1|T|U|37","8CBM|1|T|A|38","verified","","bgsu"],["stacking","s35",38,39,41,42,"8CBM|1|T|A|38","8CBM|1|T|A|39","verified","","bgsu"],["stacking","s35",39,40,42,43,"8CBM|1|T|A|39","8CBM|1|T|A|40","verified","","bgsu"],["stacking","s35",40,41,43,44,"8CBM|1|T|A|40","8CBM|1|T|U|41","verified","","bgsu"],["stacking","s35",45,46,47,48,"8CBM|1|T|A|45","8CBM|1|T|G|46","verified","","bgsu"],["stacking","s55",45,62,47,64,"8CBM|1|T|A|45","8CBM|1|T|U|62","verified","","bgsu"],["stacking","s35",46,47,48,49,"8CBM|1|T|G|46","8CBM|1|T|G|47","verified","","bgsu"],["stacking","s55",46,61,48,63,"8CBM|1|T|G|46","8CBM|1|T|U|61","verified","","bgsu"],["stacking","s35",47,48,49,50,"8CBM|1|T|G|47","8CBM|1|T|A|48","verified","","bgsu"],["stacking","s55",47,60,49,62,"8CBM|1|T|G|47","8CBM|1|T|C|60","verified","","bgsu"],["stacking","s35",48,49,50,51,"8CBM|1|T|A|48","8CBM|1|T|G|49","verified","","bgsu"],["stacking","s55",48,59,50,61,"8CBM|1|T|A|48","8CBM|1|T|C|59","verified","","bgsu"],["stacking","s35",49,50,51,52,"8CBM|1|T|G|49","8CBM|1|T|C|50","verified","","bgsu"],["stacking","s55",49,58,51,60,"8CBM|1|T|G|49","8CBM|1|T|C|58","verified","","bgsu"],["stacking","s35",50,51,52,53,"8CBM|1|T|C|50","8CBM|1|T|U|51","verified","","bgsu"],["stacking","ns35",51,52,53,54,"8CBM|1|T|U|51","8CBM|1|T|U|52","verified","","bgsu"],["stacking","s35",53,54,55,56,"8CBM|1|T|A|53","8CBM|1|T|A|54","verified","","bgsu"],["stacking","s35",54,55,56,57,"8CBM|1|T|A|54","8CBM|1|T|A|55","verified","","bgsu"],["stacking","s35",55,56,57,58,"8CBM|1|T|A|55","8CBM|1|T|C|56","verified","","bgsu"],["stacking","s35",56,57,58,59,"8CBM|1|T|C|56","8CBM|1|T|C|57","verified","","bgsu"],["stacking","s35",57,58,59,60,"8CBM|1|T|C|57","8CBM|1|T|C|58","verified","","bgsu"],["stacking","ns35",58,59,60,61,"8CBM|1|T|C|58","8CBM|1|T|C|59","verified","","bgsu"],["stacking","s35",59,60,61,62,"8CBM|1|T|C|59","8CBM|1|T|C|60","verified","","bgsu"],["stacking","s35",60,61,62,63,"8CBM|1|T|C|60","8CBM|1|T|U|61","verified","","bgsu"],["stacking","s35",61,62,63,64,"8CBM|1|T|U|61","8CBM|1|T|U|62","verified","","bgsu"],["stacking","s35",63,64,65,66,"8CBM|1|T|A|63","8CBM|1|T|U|64","verified","","bgsu"],["stacking","s35",64,65,66,67,"8CBM|1|T|U|64","8CBM|1|T|U|65","verified","","bgsu"],["stacking","s35",65,66,67,68,"8CBM|1|T|U|65","8CBM|1|T|U|66","verified","","bgsu"],["stacking","s35",66,67,68,69,"8CBM|1|T|U|66","8CBM|1|T|C|67","verified","","bgsu"]]}