{"schema_version":"1.4","rfam_acc":"RF00005","seq_name":"9gch_3_T_F","observation":"[category, fr3d_class, label_seq_id_1, label_seq_id_2, rfam_1, rfam_2, unit_id_1, unit_id_2, mapping_check, altlocs]; base pairs and stacking 5'->3' by label_seq_id (class flipped when needed); base-ribose and base-phosphate in BGSU row order: endpoint 1 = base, endpoint 2 = nucleotide whose ribose / phosphate is contacted (never re-ordered); rfam_k = consensus position (match), 'anchor^offset' (insertion) or null (outside the aligned region); last observation field: bgsu (BGSU RNA 3D Hub file) or fr3d_local (near base pair, local fr3d-python)","observations":[["basepair","cWW",1,66,2,69,"9GCH|1|T|U|2","9GCH|1|T|A|67","verified","","bgsu"],["basepair","cWW",2,65,3,68,"9GCH|1|T|A|3","9GCH|1|T|U|66","verified","","bgsu"],["basepair","cWW",3,64,4,67,"9GCH|1|T|A|4","9GCH|1|T|U|65","verified","","bgsu"],["basepair","cWW",4,63,5,66,"9GCH|1|T|A|5","9GCH|1|T|U|64","verified","","bgsu"],["basepair","cWW",5,62,6,65,"9GCH|1|T|U|6","9GCH|1|T|A|63","verified","","bgsu"],["basepair","cWW",6,61,7,64,"9GCH|1|T|A|7","9GCH|1|T|U|62","verified","","bgsu"],["basepair","tWH",7,12,8,13,"9GCH|1|T|U|8","9GCH|1|T|U|13","verified","","bgsu"],["basepair","cWW",9,21,10,24,"9GCH|1|T|G|10","9GCH|1|T|C|22","verified","","bgsu"],["basepair","cWW",10,20,11,23,"9GCH|1|T|U|11","9GCH|1|T|A|21","verified","","bgsu"],["basepair","cWW",11,19,12,22,"9GCH|1|T|U|12","9GCH|1|T|A|20","verified","","bgsu"],["basepair","cWW",12,18,13,21,"9GCH|1|T|U|13","9GCH|1|T|A|19","verified","","bgsu"],["basepair","cWW",23,39,26,42,"9GCH|1|T|U|24","9GCH|1|T|A|40","verified","","bgsu"],["basepair","cWW",24,38,27,41,"9GCH|1|T|C|25","9GCH|1|T|G|39","verified","","bgsu"],["basepair","cWW",25,37,28,40,"9GCH|1|T|A|26","9GCH|1|T|U|38","verified","","bgsu"],["basepair","cWW",26,36,29,39,"9GCH|1|T|G|27","9GCH|1|T|C|37","verified","","bgsu"],["basepair","cWW",27,35,30,38,"9GCH|1|T|A|28","9GCH|1|T|U|36","verified","","bgsu"],["basepair","cWW",44,60,47,63,"9GCH|1|T|A|45","9GCH|1|T|U|61","verified","","bgsu"],["basepair","cWW",45,59,48,62,"9GCH|1|T|G|46","9GCH|1|T|C|60","verified","","bgsu"],["basepair","cWW",46,58,49,61,"9GCH|1|T|A|47","9GCH|1|T|C|59","verified","","bgsu"],["basepair","cWW",47,57,50,60,"9GCH|1|T|G|48","9GCH|1|T|C|58","verified","","bgsu"],["basepair","cWW",48,56,51,59,"9GCH|1|T|G|49","9GCH|1|T|C|57","verified","","bgsu"],["basepair","ncWW",49,55,52,58,"9GCH|1|T|C|50","9GCH|1|T|A|56","verified","","fr3d_local"],["basepair","ntSH",50,53,53,56,"9GCH|1|T|U|51","9GCH|1|T|C|54","verified","","fr3d_local"],["basephosphate","n0BPh",30,29,33,32,"9GCH|1|T|G|31","9GCH|1|T|U|30","verified","","bgsu"],["basephosphate","n5BPh",50,53,53,56,"9GCH|1|T|U|51","9GCH|1|T|C|54","verified","","bgsu"],["basephosphate","n9BPh",56,55,59,58,"9GCH|1|T|C|57","9GCH|1|T|A|56","verified","","bgsu"],["baseribose","n0BR",2,1,3,2,"9GCH|1|T|A|3","9GCH|1|T|U|2","verified","","bgsu"],["baseribose","n0BR",3,2,4,3,"9GCH|1|T|A|4","9GCH|1|T|A|3","verified","","bgsu"],["baseribose","n1BR",9,10,10,11,"9GCH|1|T|G|10","9GCH|1|T|U|11","verified","","bgsu"],["baseribose","n0BR",12,11,13,12,"9GCH|1|T|U|13","9GCH|1|T|U|12","verified","","bgsu"],["baseribose","n0BR",19,18,22,21,"9GCH|1|T|A|20","9GCH|1|T|A|19","verified","","bgsu"],["baseribose","n0BR",20,19,23,22,"9GCH|1|T|A|21","9GCH|1|T|A|20","verified","","bgsu"],["baseribose","n9BR",29,28,32,31,"9GCH|1|T|U|30","9GCH|1|T|U|29","verified","","bgsu"],["baseribose","n0BR",32,34,35,37,"9GCH|1|T|G|33","9GCH|1|T|A|35","verified","","bgsu"],["baseribose","6BR",33,27,36,30,"9GCH|1|T|A|34","9GCH|1|T|A|28","verified","","bgsu"],["baseribose","n0BR",36,35,39,38,"9GCH|1|T|C|37","9GCH|1|T|U|36","verified","","bgsu"],["baseribose","n0BR",43,7,46,8,"9GCH|1|T|C|44","9GCH|1|T|U|8","verified","","bgsu"],["baseribose","0BR",44,6,47,7,"9GCH|1|T|A|45","9GCH|1|T|A|7","verified","","bgsu"],["baseribose","n7BR",53,50,56,53,"9GCH|1|T|C|54","9GCH|1|T|U|51","verified","","bgsu"],["baseribose","n3BR",54,14,57,15,"9GCH|1|T|G|55","9GCH|1|T|A|15","verified","","bgsu"],["baseribose","n0BR",60,59,63,62,"9GCH|1|T|U|61","9GCH|1|T|C|60","verified","","bgsu"],["baseribose","n0BR",64,63,67,66,"9GCH|1|T|U|65","9GCH|1|T|U|64","verified","","bgsu"],["stacking","s35",1,2,2,3,"9GCH|1|T|U|2","9GCH|1|T|A|3","verified","","bgsu"],["stacking","s35",2,3,3,4,"9GCH|1|T|A|3","9GCH|1|T|A|4","verified","","bgsu"],["stacking","s55",2,66,3,69,"9GCH|1|T|A|3","9GCH|1|T|A|67","verified","","bgsu"],["stacking","s35",3,4,4,5,"9GCH|1|T|A|4","9GCH|1|T|A|5","verified","","bgsu"],["stacking","s35",4,5,5,6,"9GCH|1|T|A|5","9GCH|1|T|U|6","verified","","bgsu"],["stacking","s35",5,6,6,7,"9GCH|1|T|U|6","9GCH|1|T|A|7","verified","","bgsu"],["stacking","s35",6,44,7,47,"9GCH|1|T|A|7","9GCH|1|T|A|45","verified","","bgsu"],["stacking","s55",6,62,7,65,"9GCH|1|T|A|7","9GCH|1|T|A|63","verified","","bgsu"],["stacking","ns55",7,14,8,15,"9GCH|1|T|U|8","9GCH|1|T|A|15","verified","","bgsu"],["stacking","s53",7,43,8,46,"9GCH|1|T|U|8","9GCH|1|T|C|44","verified","","bgsu"],["stacking","s35",9,10,10,11,"9GCH|1|T|G|10","9GCH|1|T|U|11","verified","","bgsu"],["stacking","s55",9,22,10,25,"9GCH|1|T|G|10","9GCH|1|T|A|23","verified","","bgsu"],["stacking","s35",10,11,11,12,"9GCH|1|T|U|11","9GCH|1|T|U|12","verified","","bgsu"],["stacking","s35",11,12,12,13,"9GCH|1|T|U|12","9GCH|1|T|U|13","verified","","bgsu"],["stacking","s35",12,13,13,14,"9GCH|1|T|U|13","9GCH|1|T|A|14","verified","","bgsu"],["stacking","s35",13,14,14,15,"9GCH|1|T|A|14","9GCH|1|T|A|15","verified","","bgsu"],["stacking","s55",13,18,14,21,"9GCH|1|T|A|14","9GCH|1|T|A|19","verified","","bgsu"],["stacking","ns35",14,54,15,57,"9GCH|1|T|A|15","9GCH|1|T|G|55","verified","","bgsu"],["stacking","s35",18,19,21,22,"9GCH|1|T|A|19","9GCH|1|T|A|20","verified","","bgsu"],["stacking","ns53",18,43,21,46,"9GCH|1|T|A|19","9GCH|1|T|C|44","verified","","bgsu"],["stacking","s35",19,20,22,23,"9GCH|1|T|A|20","9GCH|1|T|A|21","verified","","bgsu"],["stacking","s35",20,21,23,24,"9GCH|1|T|A|21","9GCH|1|T|C|22","verified","","bgsu"],["stacking","s35",21,22,24,25,"9GCH|1|T|C|22","9GCH|1|T|A|23","verified","","bgsu"],["stacking","s35",22,23,25,26,"9GCH|1|T|A|23","9GCH|1|T|U|24","verified","","bgsu"],["stacking","s35",23,24,26,27,"9GCH|1|T|U|24","9GCH|1|T|C|25","verified","","bgsu"],["stacking","s35",24,25,27,28,"9GCH|1|T|C|25","9GCH|1|T|A|26","verified","","bgsu"],["stacking","s55",24,39,27,42,"9GCH|1|T|C|25","9GCH|1|T|A|40","verified","","bgsu"],["stacking","s35",25,26,28,29,"9GCH|1|T|A|26","9GCH|1|T|G|27","verified","","bgsu"],["stacking","s55",25,38,28,41,"9GCH|1|T|A|26","9GCH|1|T|G|39","verified","","bgsu"],["stacking","s35",26,27,29,30,"9GCH|1|T|G|27","9GCH|1|T|A|28","verified","","bgsu"],["stacking","s55",26,37,29,40,"9GCH|1|T|G|27","9GCH|1|T|U|38","verified","","bgsu"],["stacking","s35",27,33,30,36,"9GCH|1|T|A|28","9GCH|1|T|A|34","verified","","bgsu"],["stacking","s53",29,33,32,36,"9GCH|1|T|U|30","9GCH|1|T|A|34","verified","","bgsu"],["stacking","s33",32,34,35,37,"9GCH|1|T|G|33","9GCH|1|T|A|35","verified","","bgsu"],["stacking","s55",33,35,36,38,"9GCH|1|T|A|34","9GCH|1|T|U|36","verified","","bgsu"],["stacking","s35",35,36,38,39,"9GCH|1|T|U|36","9GCH|1|T|C|37","verified","","bgsu"],["stacking","s35",36,37,39,40,"9GCH|1|T|C|37","9GCH|1|T|U|38","verified","","bgsu"],["stacking","s35",37,38,40,41,"9GCH|1|T|U|38","9GCH|1|T|G|39","verified","","bgsu"],["stacking","s35",38,39,41,42,"9GCH|1|T|G|39","9GCH|1|T|A|40","verified","","bgsu"],["stacking","s35",39,40,42,43,"9GCH|1|T|A|40","9GCH|1|T|C|41","verified","","bgsu"],["stacking","s35",40,41,43,44,"9GCH|1|T|C|41","9GCH|1|T|A|42","verified","","bgsu"],["stacking","s35",44,45,47,48,"9GCH|1|T|A|45","9GCH|1|T|G|46","verified","","bgsu"],["stacking","ns55",44,61,47,64,"9GCH|1|T|A|45","9GCH|1|T|U|62","verified","","bgsu"],["stacking","s35",45,46,48,49,"9GCH|1|T|G|46","9GCH|1|T|A|47","verified","","bgsu"],["stacking","s55",45,60,48,63,"9GCH|1|T|G|46","9GCH|1|T|U|61","verified","","bgsu"],["stacking","s35",46,47,49,50,"9GCH|1|T|A|47","9GCH|1|T|G|48","verified","","bgsu"],["stacking","ns55",46,59,49,62,"9GCH|1|T|A|47","9GCH|1|T|C|60","verified","","bgsu"],["stacking","s35",47,48,50,51,"9GCH|1|T|G|48","9GCH|1|T|G|49","verified","","bgsu"],["stacking","s55",47,58,50,61,"9GCH|1|T|G|48","9GCH|1|T|C|59","verified","","bgsu"],["stacking","s35",48,49,51,52,"9GCH|1|T|G|49","9GCH|1|T|C|50","verified","","bgsu"],["stacking","s55",48,57,51,60,"9GCH|1|T|G|49","9GCH|1|T|C|58","verified","","bgsu"],["stacking","s35",49,50,52,53,"9GCH|1|T|C|50","9GCH|1|T|U|51","verified","","bgsu"],["stacking","ns55",50,55,53,58,"9GCH|1|T|U|51","9GCH|1|T|A|56","verified","","bgsu"],["stacking","s35",51,52,54,55,"9GCH|1|T|U|52","9GCH|1|T|A|53","verified","","bgsu"],["stacking","s35",52,53,55,56,"9GCH|1|T|A|53","9GCH|1|T|C|54","verified","","bgsu"],["stacking","s35",53,55,56,58,"9GCH|1|T|C|54","9GCH|1|T|A|56","verified","","bgsu"],["stacking","s35",55,56,58,59,"9GCH|1|T|A|56","9GCH|1|T|C|57","verified","","bgsu"],["stacking","s35",56,57,59,60,"9GCH|1|T|C|57","9GCH|1|T|C|58","verified","","bgsu"],["stacking","s35",57,58,60,61,"9GCH|1|T|C|58","9GCH|1|T|C|59","verified","","bgsu"],["stacking","s35",58,59,61,62,"9GCH|1|T|C|59","9GCH|1|T|C|60","verified","","bgsu"],["stacking","s35",59,60,62,63,"9GCH|1|T|C|60","9GCH|1|T|U|61","verified","","bgsu"],["stacking","s35",60,61,63,64,"9GCH|1|T|U|61","9GCH|1|T|U|62","verified","","bgsu"],["stacking","s35",61,62,64,65,"9GCH|1|T|U|62","9GCH|1|T|A|63","verified","","bgsu"],["stacking","s35",62,63,65,66,"9GCH|1|T|A|63","9GCH|1|T|U|64","verified","","bgsu"],["stacking","s35",63,64,66,67,"9GCH|1|T|U|64","9GCH|1|T|U|65","verified","","bgsu"],["stacking","s35",64,65,67,68,"9GCH|1|T|U|65","9GCH|1|T|U|66","verified","","bgsu"],["stacking","s35",65,66,68,69,"9GCH|1|T|U|66","9GCH|1|T|A|67","verified","","bgsu"],["stacking","s35",66,67,69,70,"9GCH|1|T|A|67","9GCH|1|T|C|68","verified","","bgsu"]]}